<?xml version="1.0" encoding="UTF-8"?>
<!--Sample XML file generated by XMLSpy v2008 rel. 2 (http://www.altova.com)-->
<GameDescriptor xsi:noNamespaceSchemaLocation="Numberiada.xsd" xmlns:xsi="http://www.w3.org/2001/XMLSchema-instance">
	<GameType>Advance</GameType>
	<Board>
		<Size>7</Size>
		<Structure type="Explicit">
			<Squares>
				<Square row="1" column="2" color="1">
					-3
				</Square>
				<Square row="1" column="4" color="2">
					4
				</Square>
				<Square row="3" column="5" color="3">
					5
				</Square>
				<Square row="4" column="4" color="4">
					2
				</Square>
				<Square row="6" column="1" color="1">
					3
				</Square>
				<Square row="7" column="7" color="2">
					-4
				</Square>
				<Square row="6" column="6" color="3">
					12
				</Square>
				<Square row="5" column="5" color="4">
					3
				</Square>
				<Marker row="4" column="3"/>
			</Squares>
		</Structure>
	</Board>	
	<Players>
		<Player id="233">
			<Name>Mushon</Name>
			<Type>Human</Type>
			<Color>1</Color>
		</Player>
		<Player id="21233">
			<Name>Avrum</Name>
			<Type>Human</Type>
			<Color>2</Color>
		</Player>
		<Player id="456">
			<Name>Nachtze</Name>
			<Type>Computer</Type>
			<Color>3</Color>
		</Player>
		<Player id="784353">
			<Name>Aralle</Name>
			<Type>Human</Type>
			<Color>4</Color>
		</Player>
	</Players>	
</GameDescriptor>
