<?xml version="1.0" encoding="UTF-8"?>
<!--Sample XML file generated by XMLSpy v2008 rel. 2 (http://www.altova.com)-->
<GameDescriptor xsi:noNamespaceSchemaLocation="Numberiada.xsd" xmlns:xsi="http://www.w3.org/2001/XMLSchema-instance">
	<GameType>Advance</GameType>
	<Board>
		<Size>7</Size>
		<Structure type="Random">
			<Range to="10" from="-5"/>
		</Structure>
	</Board>	
	<Players>
		<Player id="233">
			<Name>Mushon</Name>
			<Type>Human</Type>
			<Color>1</Color>
		</Player>
		<Player id="21233">
			<Name>Avrum</Name>
			<Type>Human</Type>
			<Color>2</Color>
		</Player>
		<Player id="456">
			<Name>Nachtze</Name>
			<Type>Computer</Type>
			<Color>3</Color>
		</Player>
		<Player id="784353">
			<Name>Aralle</Name>
			<Type>Human</Type>
			<Color>4</Color>
		</Player>
	</Players>
</GameDescriptor>
