<?xml version="1.0" encoding="UTF-8"?>
<!--Sample XML file generated by XMLSpy v2008 rel. 2 (http://www.altova.com)-->
<GameDescriptor xsi:noNamespaceSchemaLocation="Numberiada.xsd" xmlns:xsi="http://www.w3.org/2001/XMLSchema-instance">
	<GameType>Basic</GameType>
	<Board>
		<Size>5</Size>
		<Structure type="Random">
			<Range from="5" to="6"/>
		</Structure>
	</Board>	
	<Players>
		<Player id="1">
			<Name>RowPlayer</Name>
			<Type>Human</Type>
			<Color>0</Color>
		</Player>
		<Player id="2">
			<Name>ColumnPlayer</Name>
			<Type>Computer</Type>
			<Color>0</Color>
		</Player>
	</Players>	
</GameDescriptor>
