<?xml version="1.0" encoding="UTF-8"?>
<!--Sample XML file generated by XMLSpy v2008 rel. 2 (http://www.altova.com)-->
<GameDescriptor xsi:noNamespaceSchemaLocation="Numberiada.xsd" xmlns:xsi="http://www.w3.org/2001/XMLSchema-instance">
	<GameType>Basic</GameType>
	<Board>
		<Size>8</Size>
		<Structure type="Explicit">
			<Squares>
				<Square row="1" column="2" color="0">
					-3
				</Square>
				<Square row="1" column="4" color="0">
					4
				</Square>
				<Square row="3" column="5" color="0">
					5
				</Square>
				<Square row="4" column="4" color="0">
					2
				</Square>
				<Square row="6" column="1" color="0">
					3
				</Square>
				<Square row="7" column="7" color="0">
					-4
				</Square>
				<Square row="6" column="6" color="0">
					12
				</Square>
				<Marker row="4" column="3"/>
			</Squares>
		</Structure>
	</Board>	
</GameDescriptor>
